{
  "$schema": "https://json-schema.org/draft/2020-12/schema",
  "$id": "https://watchcraft.dev/schema/collection-v4.json",
  "title": "Watchcraft Collection",
  "type": "object",
  "required": [
    "kind",
    "schema_version",
    "collection_id",
    "title",
    "topic_scope",
    "root",
    "topics",
    "topic_families",
    "items",
    "stats",
    "revision",
    "content_hash"
  ],
  "properties": {
    "kind": { "const": "watchcraft.collection" },
    "schema_version": { "const": 4 },
    "collection_id": { "$ref": "#/$defs/id" },
    "title": { "type": "string", "minLength": 1 },
    "description": { "type": "string" },
    "onboarding": {
      "type": "object",
      "additionalProperties": false,
      "properties": {
        "intro": { "type": "string", "minLength": 1, "maxLength": 2000, "pattern": "\\S" },
        "media_folder_prompt": { "type": "string", "minLength": 1, "maxLength": 200, "pattern": "\\S" },
        "media_folder_help": { "type": "string", "minLength": 1, "maxLength": 2000, "pattern": "\\S" }
      }
    },
    "media_root_hint": { "$ref": "#/$defs/path" },
    "publisher": {},
    "metadata_url": { "type": "string" },
    "license": {},
    "source": {},
    "topic_scope": { "const": "collection" },
    "topic_normalization": { "type": ["object", "null"] },
    "root": { "$ref": "#/$defs/group" },
    "topics": {
      "type": "object",
      "additionalProperties": { "$ref": "#/$defs/topic" }
    },
    "topic_families": {
      "type": "object",
      "additionalProperties": { "$ref": "#/$defs/topicFamily" }
    },
    "items": {
      "type": "object",
      "additionalProperties": { "$ref": "#/$defs/item" }
    },
    "stats": {
      "type": "object",
      "required": ["video_count", "topic_count", "topic_family_count"],
      "properties": {
        "video_count": { "type": "integer", "minimum": 0 },
        "topic_count": { "type": "integer", "minimum": 0 },
        "topic_family_count": { "type": "integer", "minimum": 0 }
      },
      "additionalProperties": false
    },
    "revision": { "type": "integer", "minimum": 1 },
    "content_hash": { "type": "string", "pattern": "^[a-f0-9]{64}$" }
  },
  "additionalProperties": true,
  "$defs": {
    "id": { "type": "string", "minLength": 1 },
    "path": {
      "type": "string",
      "minLength": 1,
      "not": { "pattern": "^(?:/|[A-Za-z]:[\\\\/])" }
    },
    "group": {
      "type": "object",
      "required": ["type", "group_id", "title", "children"],
      "properties": {
        "type": { "const": "group" },
        "group_id": { "$ref": "#/$defs/id" },
        "title": { "type": "string" },
        "children": {
          "type": "array",
          "items": {
            "oneOf": [
              { "$ref": "#/$defs/group" },
              { "$ref": "#/$defs/videoRef" }
            ]
          }
        }
      },
      "additionalProperties": false
    },
    "videoRef": {
      "type": "object",
      "required": ["type", "item_id"],
      "properties": {
        "type": { "const": "video" },
        "item_id": { "$ref": "#/$defs/id" }
      },
      "additionalProperties": false
    },
    "topic": {
      "type": "object",
      "required": ["topic_id", "canonical_key", "label", "aliases", "video_count", "family_ids", "related_topic_ids"],
      "properties": {
        "topic_id": { "$ref": "#/$defs/id" },
        "canonical_key": { "type": "string" },
        "label": { "type": "string", "minLength": 1 },
        "aliases": { "type": "array", "items": { "type": "string" }, "uniqueItems": true },
        "video_count": { "type": "integer", "minimum": 0 },
        "family_ids": { "type": "array", "items": { "$ref": "#/$defs/id" }, "uniqueItems": true },
        "related_topic_ids": { "type": "array", "items": { "$ref": "#/$defs/id" }, "uniqueItems": true }
      },
      "additionalProperties": false
    },
    "topicFamily": {
      "type": "object",
      "required": ["family_id", "canonical_key", "label", "description", "topic_ids", "video_count"],
      "properties": {
        "family_id": { "$ref": "#/$defs/id" },
        "canonical_key": { "type": "string" },
        "label": { "type": "string", "minLength": 1 },
        "description": { "type": "string" },
        "topic_ids": { "type": "array", "items": { "$ref": "#/$defs/id" }, "uniqueItems": true },
        "video_count": { "type": "integer", "minimum": 0 }
      },
      "additionalProperties": false
    },
    "item": {
      "type": "object",
      "required": ["item_id", "title", "media", "analysis", "summary", "locations", "topic_ids", "family_ids", "topic_sections", "chapter_count"],
      "properties": {
        "item_id": { "$ref": "#/$defs/id" },
        "title": { "type": "string", "minLength": 1 },
        "media": {
          "type": "array",
          "minItems": 1,
          "items": { "$ref": "#/$defs/mediaReference" }
        },
        "transcript": {
          "deprecated": true,
          "description": "Legacy schema-v4 field. New collections omit transcript references.",
          "type": "object",
          "properties": {
            "subtitles": { "$ref": "#/$defs/path" },
            "text": { "$ref": "#/$defs/path" },
            "segments": { "$ref": "#/$defs/path" }
          },
          "additionalProperties": false
        },
        "analysis": {
          "type": "object",
          "required": ["path"],
          "properties": {
            "path": { "$ref": "#/$defs/path" },
            "schema_version": { "type": ["integer", "null"] },
            "model": { "type": ["string", "null"] }
          },
          "additionalProperties": false
        },
        "summary": { "type": "string" },
        "date": { "type": ["object", "string", "null"] },
        "locations": { "type": "array" },
        "topic_ids": { "type": "array", "items": { "$ref": "#/$defs/id" }, "uniqueItems": true },
        "family_ids": { "type": "array", "items": { "$ref": "#/$defs/id" }, "uniqueItems": true },
        "topic_sections": {
          "type": "object",
          "additionalProperties": {
            "type": "array",
            "items": { "type": "integer", "minimum": 0 },
            "uniqueItems": true
          }
        },
        "chapter_count": { "type": "integer", "minimum": 0 }
      },
      "additionalProperties": false
    },
    "mediaReference": {
      "oneOf": [
        {
          "type": "object",
          "required": ["type", "relative_path"],
          "properties": {
            "type": { "const": "local-file" },
            "delivery": { "enum": ["managed-local", "referenced-local"] },
            "relative_path": { "$ref": "#/$defs/path" }
          },
          "additionalProperties": false
        },
        {
          "type": "object",
          "required": ["type", "video_id"],
          "properties": {
            "type": { "const": "youtube" },
            "delivery": { "const": "remote" },
            "video_id": { "type": "string", "minLength": 1 },
            "url": { "type": "string", "format": "uri" }
          },
          "additionalProperties": false
        },
        {
          "type": "object",
          "required": ["type", "url"],
          "properties": {
            "type": { "const": "http-video" },
            "delivery": { "const": "remote" },
            "url": { "type": "string", "format": "uri", "pattern": "^https?://" }
          },
          "additionalProperties": false
        }
      ]
    }
  }
}
